<?xml version="1.0" encoding="UTF-8"?>
<xs:schema xmlns:xs="http://www.w3.org/2001/XMLSchema">
    <xs:element name="pedidos">
        <xs:complexType>
            <xs:sequence>
                <xs:element name="pedido" maxOccurs="unbounded">
                    <xs:complexType>
                        <xs:sequence>
                            <xs:element name="cliente" type="xs:string"/>
                            <xs:element name="postre" type="xs:string"/>
                            <xs:element name="cantidad" type="xs:integer"/>
                            <xs:element name="estado" type="xs:string"/>
                        </xs:sequence>
                    </xs:complexType>
                </xs:element>
            </xs:sequence>
        </xs:complexType>
    </xs:element>
</xs:schema>